topic,documents,share,keywords,Name
0,61,0.187,"déploiement, établissements, place, acteurs, mise, niveau, cadre, sein, outils, mise place, usage, entre",0_déploiement_établissements_place_acteurs
1,36,0.11,"investment, research, strategy, compute, public, fund, company, phase, economic, power, european, global",1_investment_research_strategy_compute
2,109,0.334,"données, usage, outils, utilisation, évaluation, critique, cadre, pédagogique, ressources, risques, utiliser, génératives",2_données_usage_outils_utilisation
3,43,0.132,"language, chatgpt, teach, source, assessment, large, task, user, module, response, prompt, word",3_language_chatgpt_teach_source
4,26,0.08,"court, legal, patent, precedent, protect, regulation, decision, cnil, creative, protection, intellectual, property",4_court_legal_patent_precedent
5,25,0.077,"répondants, questionnaire, réponses, oui, extrait, manque, usage, temp, répondants répondants, extrait questionnaire, freins, sais",5_répondants_questionnaire_réponses_oui
6,26,0.08,"numérique, recherche, académique, unesco, directeur, adjoint, billet, billet recherche, académie, directrice, délégué, lycée",6_numérique_recherche_académique_unesco
