topic,documents,share,keywords,Name,topic_label,topic_prototype,policy_area,is_coherent,artifact_topic,merge_hint
0,61,0.187,"déploiement, établissements, place, acteurs, mise, niveau, cadre, sein, outils, mise place, usage, entre",0_déploiement_établissements_place_acteurs,National AI Curriculum Development and School Coordination,The French government plans to develop an AI curriculum for schools while coordinating efforts across different levels of administration.,AI in Education,True,False,Merge with 'National AI Curriculum Development and School Coordination'
1,36,0.11,"investment, research, strategy, compute, public, fund, company, phase, economic, power, european, global",1_investment_research_strategy_compute,France's National AI Strategy and Funding,France invests heavily in AI through strategic planning and significant funding.,AI Strategy and Funding,True,False,Investment in AI includes both public and private sectors.
2,109,0.334,"données, usage, outils, utilisation, évaluation, critique, cadre, pédagogique, ressources, risques, utiliser, génératives",2_données_usage_outils_utilisation,AI in Education and Pédagogical Practices,"Éduquer à l'IA : comprendre les enjeux éducatifs et éthiques, maîtriser l'utilisation et l'évaluation des outils IA, respecter les droits des jeunes et garantir la sécurité numérique.",Éducation et pédagogie,True,False,"Utilisez ce label pour aborder les aspects éducatifs et pédagogiques concernant l'IA, y compris la formation des enseignants, l'utilisation des outils IA, et la protection des droits des élèves."
3,43,0.132,"language, chatgpt, teach, source, assessment, large, task, user, module, response, prompt, word",3_language_chatgpt_teach_source,Large Language Models in Educational Technology,Exploring the role of large language models in enhancing educational technology.,Education,True,False,"Focus on how these models can improve teaching methods, accessibility, and personalized learning experiences."
4,26,0.08,"court, legal, patent, precedent, protect, regulation, decision, cnil, creative, protection, intellectual, property",4_court_legal_patent_precedent,French AI Law and Regulation,France's approach to regulating AI through legal precedents and court rulings.,AI Law and Regulation,True,False,
5,25,0.077,"répondants, questionnaire, réponses, oui, extrait, manque, usage, temp, répondants répondants, extrait questionnaire, freins, sais",5_répondants_questionnaire_réponses_oui,"AI in French Schools: Usage, Responses, and Challenges",French schools implementing AI tools and their impact on teaching methods.,Education,True,False,Merge with 'AI in School Management Systems'
6,26,0.08,"numérique, recherche, académique, unesco, directeur, adjoint, billet, billet recherche, académie, directrice, délégué, lycée",6_numérique_recherche_académique_unesco,Academic Digital Transformation Leadership in France,France's approach to integrating digital technologies into academic leadership roles.,Academic Governance,True,False,Focus on the role of directors and deputy-directors in implementing digital strategies.
