scope_label,scope_type,best_num_topics,best_coherence,best_diversity,topic_id,topic_terms,topic_terms_with_weights
global_sentiment,sentiment_corpus_input,5,0.6213507680151868,0.9333333333333333,0,"fear, high, score, perception, discourse, analysis, optimism, age, limerick, narrative, employment, confidence, hope, dublin, cork","fear (0.0215), high (0.0206), score (0.0117), perception (0.0117), discourse (0.0114), analysis (0.0114), optimism (0.0104), age (0.0096), limerick (0.0087), narrative (0.0085), employment (0.0084), confidence (0.0083), hope (0.0081), dublin (0.0080), cork (0.0077)"
global_sentiment,sentiment_corpus_input,5,0.6213507680151868,0.9333333333333333,1,"group, ethic, staff, governance, bias, engage, framework, address, company, project, design, lead, space, follow, institution","group (0.0119), ethic (0.0110), staff (0.0100), governance (0.0070), bias (0.0062), engage (0.0062), framework (0.0051), address (0.0051), company (0.0049), project (0.0048), design (0.0048), lead (0.0047), space (0.0046), follow (0.0045), institution (0.0045)"
global_sentiment,sentiment_corpus_input,5,0.6213507680151868,0.9333333333333333,2,"pathway, agree, mooc, knowledge, experience, perception, number, percentage, class, day, negative, positive, follow, result, help","pathway (0.0195), agree (0.0146), mooc (0.0110), knowledge (0.0107), experience (0.0105), perception (0.0091), number (0.0086), percentage (0.0083), class (0.0079), day (0.0076), negative (0.0075), positive (0.0071), follow (0.0069), result (0.0068), help (0.0068)"
global_sentiment,sentiment_corpus_input,5,0.6213507680151868,0.9333333333333333,3,"know, comment, idea, indicative, information, point, subject, help, yap, day, year, useful, language, start, find","know (0.0234), comment (0.0118), idea (0.0108), indicative (0.0099), information (0.0099), point (0.0090), subject (0.0087), help (0.0086), yap (0.0083), day (0.0082), year (0.0079), useful (0.0075), language (0.0072), start (0.0067), find (0.0062)"
global_sentiment,sentiment_corpus_input,5,0.6213507680151868,0.9333333333333333,4,"confidence, oversight, assessment, responsible, effect, protection, competence, secondary, training, strategy, academic, task, trust, critical, integrity","confidence (0.0417), oversight (0.0369), assessment (0.0100), responsible (0.0090), effect (0.0087), protection (0.0084), competence (0.0083), secondary (0.0077), training (0.0069), strategy (0.0069), academic (0.0067), task (0.0066), trust (0.0064), critical (0.0063), integrity (0.0062)"
