Source_File,Title,Content,Country,Chunk_ID,Topic_ID,Topic_Label_Description
Australian Framework for Generative AI in Schools Poster - PDF.pdf,Australian Framework for Generative AI in Schools Poster - PDF.pdf,"Australian Framework for Generative AI in Schools Poster - PDF.pdf Australian Framework for Generative Artificial Intelligence in Schools The Australian Framework for Generative Artificial Intelligence (AI) in Schools (the Framework) seeks to guide the responsible and ethical use of generative AI tools in ways that benefit students, schools and society. It was developed on behalf of all Education Ministers by the National AI in Schools Taskforce, which includes representatives from all jurisdictions, education sectors and the national education agencies. Teaching and Learning Human and Transparency Fairness Accountability Privacy, Security Social Wellbeing and Safety Generative AI tools are used to Generative AI tools are used School communities understand Generative AI tools are used in Generative AI tools are used in Students and others using support and enhance teaching to benefit all members of the how generative AI tools work, how ways that are accessible, fair, ways that are open to challenge generative AI tools have their and learning. school community. they can be used, and when and and respectful. and retain human agency and privacy and data protected. how these tools are impacting them. accountability for decisions. 1.1 Impact: generative AI tools are used 2.1 Wellbeing: generative AI tools are 3.1 Information and support: teachers, 4.1 Accessibility and inclusivity: 5.1 Human responsibility: teachers 6.1 Privacy and data protection: in ways that enhance and support used in ways that do not harm the students, staff, parents and carers generative AI tools are used in ways and school leaders retain control generative AI tools are used in ways teaching, school administration, wellbeing and safety of any member have access to clear and appropriate that enhance opportunities, and are of decision making and remain that respect and uphold privacy and and student learning. of the school community. information and guidance about inclusive, accessible, and equitable accountable for decisions that are data rights, comply with Australian generative AI. for people with disability and from supported by the use of generative law, and avoid the unnecessary 1.2 Instruction: schools engage students 2.2 Diversity of perspectives: diverse backgrounds. AI tools. collection, limit the retention, prevent in learning about generative AI tools generative AI tools are used in ways 3.2 Disclosure: school communities further distribution, and prohibit the and how they work, including their that expose users to diverse ideas are appropriately informed when 4.2 Equity and access: regional, rural and 5.2 Reliability: generative AI tools are sale of student data. potential limitations and biases, and perspectives and avoid the generative AI tools are used in ways remote communities are considered tested before they are used, and and deepen this learning as student reinforcement of biases. that impact them. when implementing generative AI. reliably operate in accordance with 6.2 Privacy disclosure: school usage increases. their intended purpose. communities are proactively informed 2.3 Human rights: generative AI tools 3.3 Explainability: vendors ensure that 4.3 Non-discrimination: generative AI about how and what data will be 1.3 Teacher expertise: generative AI tools are used in ways that respect end users broadly understand the tools are used in ways that support 5.3 Monitoring: the impact of generative collected, used, and shared while are used in ways that support teacher human and worker rights, including methods used by generative AI tools inclusivity, minimising opportunities AI tools on school communities is using generative AI tools, and expertise, and teachers are recognised individual autonomy and dignity. and their potential biases. for, and countering, unfair actively and regularly monitored, and consent is sought where needed. and respected as the subject matter discrimination against individuals, emerging risks and opportunities are experts within the classroom. communities, or groups. identified and managed.",Australia,1,2,W
Australian Framework for Generative AI in Schools Poster - PDF.pdf,Australian Framework for Generative AI in Schools Poster - PDF.pdf,"Australian Framework for Generative AI in Schools Poster - PDF.pdf and their potential biases. for, and countering, unfair actively and regularly monitored, and consent is sought where needed. and respected as the subject matter discrimination against individuals, emerging risks and opportunities are experts within the classroom. communities, or groups. identified and managed. 6.3 Protection of student inputs: students, teachers and staff take 1.4 Critical thinking: generative AI tools 4.4 Cultural and intellectual property: 5.1 Contestability: members of appropriate care when entering are used in ways that support and generative AI tools are used in ways school communities that are information into generative AI enhance critical thinking and creativity, that respect the cultural rights of impacted by generative AI tools are tools which may compromise any rather than restrict human thought various cultural groups, including actively informed about, and have individual’s data privacy. and experience. Indigenous Cultural and Intellectual opportunities to question, the use Property (ICIP) rights. or outputs of the tools and any 6.4 Cyber-security and resilience: 1.5 Learning design: work designed for decisions informed by the tools. robust cyber-security measures students, including assessments, are implemented to protect the clearly outlines how generative AI integrity and availability of school tools should or should not be used infrastructure, generative AI tools, and allows for a clear and unbiased and associated data. evaluation of student ability. 6.5 Copyright compliance: when using 1.6 Academic integrity: students are generative AI tools, schools are aware supported to use generative AI tools of, and take measures to comply ethically in their schoolwork, including with, applicable copyright rights by ensuring appropriate attribution. and obligations. Access the full framework via the QR code for additional information on its Australian Framework for Generative Artificial Intelligence in Schools © Commonwealth of Australia, 2023 intended purpose and audience.",Australia,2,2,W
DOAI-24-Educator-Guide.pdf,DOAI-24-Educator-Guide.pdf,"DOAI-24-Educator-Guide.pdf Educator Guide DAYOFAIAUSTRALIA.COM Overview DayofAIisacompleteunitofworkconsistingoffivesequencedlessons.Eachlessonconsistsofa setofpresentationslides,teacher-andstudent-ledactivitiesanddiscussions,aswellashands-onAI toolsthatstudentscanengagewith.Inaddition,studentscanapplytheirknowledge,skillsand creativitytosolveareal-worldprobleminourStudentChallenge,fortheirchancetowinsomegreat prizes. RATIONALE ArtificialIntelligence(AI)encompassesarangeofcomplextechnologiesthathavealreadyhada considerableimpactontheworldaroundus.Itissomethingthataffectsandwillincreasinglyimpact ourlivesdaily,inAustraliaandaroundtheworld. AbasicliteracyofAI–whatitis,howitworks,itsethicalimplicationsanditsimpactonsociety–is anessentialpartofamoderneducationforallyoungAustralians.DayofAIisdesignedtospark students’curiosityaboutAIandtoencouragethemtounderstandthetechnologyatahighlevel,and developtheskillsthatwillbecriticaltothefuture. AIMS DayofAI’scurriculumaimstoensurethatstudents: ・ DevelopanunderstandingofwhatArtificialIntelligence(AI)is ・ ExploreandinteractwithAIsystemsinasafeandresponsiblemanner ・ Understandhowalgorithmsareusedtoprocessdataintopredictions ・ Exploredataanditsmanyforms,includingimages,soundandtext ・ Learnhowmachinesrequirecurateddatasetstolearn,orgainintelligence ・ ConsidermodernexamplesofgenerativeAItechnology,andexploreitsimplications ・ ReflectonethicalconsiderationsrelatingtoAI,includingbiasandresponsibleuse ・ DiscoverhowAIisimpactingawiderangeofindustriestoday CURRICULUM ALIGNMENT DayofAIisalignedtotheAustralianCurriculum(Version9)developedbytheAustralianCurriculum, AssessmentandReportingAuthority(ACARA)acrossanumberofdimensions. Artificial Intelligence (AI) Curriculum Connection DayofAIalignswiththeArtificialIntelligence(AI)curriculumconnection’sstatedpurposeto: DAYOFAIAUSTRALIA.COMI1 ・ DevelopstudentunderstandingofconceptsassociatedwithAIsystemsandtheresponsible useofAI;and ・ EncouragestudentsandteacherstocriticallyevaluatethebroaderimpactofAIonsocietyand reflectonethicalconsiderations DayofAIalsoalignsdirectlywiththekeyaspectsoftheAIcurriculumconnection: UnderstandinghowAIworks Studentsdevelopknowledgeofhowconceptsassociatedwithpatternrecognition,chance,dataand algorithmsareappliedtotrainAIthroughmachinelearningtoproduceanoutputorresult,andhow thequalityofthetrainingdataimpactsonthequality,reliabilityandbiasoftheoutput. TypesofAI(digitaltoolsandAIsystems) StudentsexplorehowAIsystemscanbeusedtoperformtasksorsolveproblemsusingpredictive strategiesbasedonlargeamountsofdata,operatedbymachinelearningandpredictivealgorithms suchasthoseusedinautonomousvehicles,roboticsystemsandgenerativeAIplatforms.Theybuild awarenessandassessifadigitaltoolincludesAIinitsdesignandfunction. ResponsibleuseandapplicationofAI Studentsconsidertheirneedsandthoseofotherswhenacquiringdataforpurposessuchasdata associatedwithmachinelearningalgorithmsusedintrainingapplicationsforAIsystems.Theylearn aboutethicalconsiderationsrelatingtotheuseofAI,suchasjobdisplacement,economicand environmentalsustainability,andtheneedfordiverserepresentationinAIdesignanddevelopment toaddressissuesofbias. Learning Areas DayofAIlessonscoverarangeofcontentdescriptorsacrosstheMathematicsandDigital Technologieslearningareas.Pleaserefertoindividuallessonplans,availableonourLMSoncelogged in,forlinkstospecificcontentdescriptors.Seebandlevellearningsummariesbelow. Years5and6 StudentshavetheopportunitytoconsidertheimpactofAIsystemsfrommultipleperspectivesas usersordesignersofAI.TheyexploretheoutputofvariousAIsystemsandusecriticalthinkingand researchtechniquestoevaluatetheresponseofchatbotstodifferenttypesofquestionsand prompts.Studentsinvestigatebiasandfairnessinrelationtooutcomesanddiscusshowthismight informstrategiesformitigatingbiasinAIsystems. Years7and8 StudentsevaluatetheadvantagesanddisadvantagesofAI.Theyconsidersocietyandethics,and economic,environmentalandsocialsustainabilityfactors.Studentsconsiderthedesignandpurpose ofAIsystemsandinvestigatehowAIagentsmakedecisionsrelatingtosamplingtechniques, recognisingtheneedtomitigateanypotentialbias.TheyexplorehowgenerativeAIsystemscanbe usedtogeneratesyntheticdatathatcloselyresemblesthedistributionofrealdatafromprimary sources.Studentsdecomposereal-worldproblemsandconsidertheroleofAIasadesignedsolution. DAYOFAIAUSTRALIA.COMI2 Years9and10 StudentsusetheircomputationalthinkingskillsanddigitaltoolsincludinggenerativeAIto decomposereal-worldproblemsandcriticallyevaluatealternativesolutionsagainststakeholder eliciteduserstories.Studentshaveopportunitiestorecognisehowtheidentificationofbiasisa criticalaspectofmachinelearninganddeeplearning,andhowbiasessignificantlyimpactthe fairness,accuracyandethicalimplicationsofAIsystems. General Capabilities DayofAIprovidesopportunitiesforstudentstodevelopthefollowinggeneralcapabilities: DigitalLiteracy StudentshavemultipleopportunitiestousedigitalAItoolsandlearnaboutthecontextandpurposes ofusingAIsystemsandapplications,andconsidertheiruseastypesofdigitaltools.Studentsalso considertheintellectualpropertyimplications,originalityandownershipofcontentcreatedwithAI, andobligationsconcerningattributionofexistingauthorswhoseworkmayhavebeenincludedinan AIdataset,withorwithoutpermission,orusedastrainingdata.InourStudentChallenge,students createAIasadesignedsolutiontotacklesustainabilityandclimatechange. EthicalUnderstanding StudentsinvestigateandmakedecisionsabouttheethicaluseandapplicationofAIinreal-world situations.Studentsconsiderbiasandconsiderhowdifferentstakeholderperspectivesmay influencedecision-makingprocesses.Studentsalsoexploreintentionalandaccidentalerrorsor distortionsinAI-generatedmedia,andquestionthevalidityinpropositionsandinferences. CriticalandCreativeThinking StudentslearnaboutandcriticallyreflectongenerativeAIincludinglargelanguagemodels(LLMs)by identifying,processingandevaluatinginformationthatisreturnedasoutputfromAIsystemsand interrogatingthereturnedresponsesforbiasandreliability.StudentsalsoexploretheuseofAIfor generatingandconnectingideasorgeneratingalternativesolutionstoproblems. PersonalandSocialCapability Studentshavemultipleopportunitiestodevelopempathyandbuildrespectfortheneedsand concernsofothersandtheirperspectives. Cross-Curriculum Priorities Sustainability InourStudentChallenge,studentswillapplytheconceptslearnedthroughoutpreviouslessonsby developinganideafortheirownAItechnologyprojectthattacklesclimatechange,environmental issueslikeairpollutionanddeforestation,orhelpsimprovesustainabilityincommunitiesin Australiaoraroundtheworld. DAYOFAIAUSTRALIA.COMI3 USE OF AI TOOLS Inourlessonmaterials,wemakeuseofanumberofAItoolstocreatepractical,hands-onactivities thatareengagingforstudents.Wehavereviewedandmeasuredeachofthesetoolsagainstrelevant policiessuchastheAustralianFrameworkforGenerativeArtificialIntelligence(AI)inSchools. YoucanfindlinkstotheAItoolsweuseineachlessonplan,aswellasonourhelpfultechsheet resourcewhichyoucansharewithyourITteamtoensurestudentscanaccessthetoolsduringyour classes. USE OF CHATGPT IN LESSON 3 Lesson3:HowdoMachinesCreateThings?featuresanactivitywhereyouwillfacilitatean interactivesessionandguideddiscussionusingChatGPT.Wehavepurposefullydesignedthis activityasateacher-leddemonstrationandguideddiscussionfortwomainreasons:1)toensurethe safeandresponsibleuseofChatGPTinlinewiththeAustralianFrameworkforGenerativeArtificial Intelligence(AI)inSchools,and2)toensurecompliancewithOpenAI’stermsofuseforChatGPT, whichrequirespeopletobe“atleast13yearsoldtoconsenttousetheServices.” PLEASENOTE: ● Asofthe1stofApril2024,ChatGPTnolongerrequiresanaccounttouse.Youmaystillbe promptedtologin,butyoucanchoosetocontinuewithoutdoingso. ● OpenAI’sTermsofUsestillapply,meaningstudentsunder13cannotusetheservice,and studentsunder18requirepermissionfromalegalparentorguardiantousetheservice. ● DatawhichyouprovidetoChatGPTviathetextpromptinterfacemaybeusedintrainingtheAI infuture.Youcanopt-outofthisbehaviourbyfollowingtheseinstructions. ● Takecarenottoincludeandpersonallyidentifyinginformation(PII)aboutyouoryour studentsinyourinputpromptstoChatGPT,toensurecompliancewiththePrivacyAct1988 andotherrelevantlegislationinyourstateorterritory. Asaresponsibleadult,youcansafelyguidestudentsthroughconversationswithChatGPT,taking inputfromstudentsonlyasyoudeemappropriate.Westronglyencourageyoutopauseoftenduring thisactivitytoallowstudentstoaskquestions,andgivethemanopportunitytosharetheirthoughts andfeelingsaroundlargelanguagemodelslikeChatGPT.Somestudentsmayneedadditionaltimeto reflectontheimplicationsofthetechnology.Ifyoufeeltheneed,re-emphasisethatChatGPT(and othergenerativeAImodelslikeit)aresimplyatool,onethatcanbeusedresponsiblylikeanyother tool. LESSON STREAMING Ourprogramisdividedintotwostreams,labelled'Junior'and'Senior'.Wehavedeliberatelyusedthese terms,ratherthanyearlevels,todescribethelessonsinordertoprovideflexibilitytoteachersinhow theycanbeused.OurrecommendationisthatJuniorcorrelatestoYears5and6,andSenior correlatestoYears7to10. DAYOFAIAUSTRALIA.COMI4 However,itisentirelyuptoyouastheteachertodecidewhichlessonisappropriateforyourstudents. Thereisnocontentineitherstreamthatpresentsabarrierforanyagegroup.Pleasefeelfreetouse whicheverversionofthelessonthatismostappropriateforyourstudents.Lessons1-3arethesame forbothstreams.Lesson4hasbothaJuniorandaSeniorversion,andLesson5hasaSeniorversion onlyandisoptionalforthoseintheJuniorstream. REQUIREMENTS ・ Awebbrowser,e.g.GoogleChromeorMicrosoftEdge ・ Internetaccess ・ Awaytoprojectpresentationslides(e.g.projector,smartboard,TV)andspeakers ・ Whiteboard,blackboard,orchartpaper ・ Chromebooks,laptops,ordesktopPCswithafunctionalwebcam ○ Onedevicepertwostudentsisrecommended PROGRAM RESOURCES THELESSONS DayofAIisavailable viaourwebsitedayofaiaustralia.com ToaccesstheselessonsinourLearning ManagementSystem(LMS)youwillneedto registerasaTeacherorPrincipalfor2024 here. TEACHERSUPPORT Supportisavailabletoalleducators.Youcan: ● WatchtheteachersupportvideosonYouTubeorthroughtheLMS ● AccesstheFAQandadditionalresourcesonourwebsite ● Contactsupportathello@dayofaiaustralia.com Visitdayofaiaustralia.com/teacherstoaccesstheseresources. NEXT STEPS AftercompletingtheDayofAIprogram,studentsmaywishtocontinuetheirlearningjourneyto discovermoreaboutAIandotherareasofSTEM.Wehavecollatedarangeofopportunitiesfor DAYOFAIAUSTRALIA.COMI5 teachers,parentsandstudentstoextendtheirlearning,developnewskills,andconnectwith like-mindedpeersthroughotherschoolprograms,advicefromkeyorganisationsinAustraliaand takingpartinotherchallenges,competitions,excursionsandholidayprograms.Findoutmoreby visitingourwebsiteatdayofaiaustralia.com/additional-resources. LESSON PLAN OUTLINE Availableonceyouhaveregisteredfor2024,youwillhaveaccesstotheprograms.Eachprogramis dividedintolessons,withalessonplanprovidedforeachone.Hereisanoutlineofthelessonsand plansavailable. Lesson1:WhatisArtificialIntelligence?|45mins ALLYEARS Lesson2:HowdoMachinesLearn?|45mins ALLYEARS Lesson3:HowdoMachinesCreateThings?|60mins ALLYEARS Lesson4:EthicsandtheResponsibleUseofAI|60mins JUNIORPROGRAM Lesson4:EthicsandtheMisinformationinAI|60mins SENIORPROGRAM Lesson5:AIinDifferentCareersandIndustries|60mins SENIORPROGRAM StudentChallenge:UsingAItoTackleSustainability|45mins JUNIOR StudentChallenge:UsingAItoTackleSustainability&ClimateChange|45mins SENIOR DAYOFAIAUSTRALIA.COMI6",Australia,1,6,A
generative-artificial-intelligence-in-schools-information-for-students-and-parents.pdf,generative-artificial-intelligence-in-schools-information-for-students-and-parents.pdf,"generative-artificial-intelligence-in-schools-information-for-students-and-parents.pdf Generative artificial intelligence in schools – information for students and parents What is generative artificial intelligence? Generative artificial intelligence (AI) enables computers and systems to create new content such as text, images, videos, software code and music, that mimics what humans can produce. Generative AI learns from large amounts of data to recognise patterns and produce the best response to a given human prompt. When a prompt is provided, the generative AI tool generates an output, such as a sentence, picture or model aligned to the prompt. Generative AI policy The Department of Education and Training (department) allows the use of generative AI in schools guided by Northern Territory Government and department policy. Schools may develop their own processes and expectations to help the school community meet these policy expectations. Students should adhere to school processes and guidance when using generative AI tools. Benefits and limitations of generative AI Generative AI tools benefit both teachers and students by supporting thinking and have the potential to have a positive impact on learning. However, generative AI tools can also: • show bias and use stereotypes • provide incorrect information, such as leaving out important details or creating false information • provide information that is not always original, instead providing the most likely response. How can generative AI be used in schools or at home? The application of generative AI can differ across year levels. Some common uses are shown below. To support teaching and learning To support student learning • generate ideas for lesson planning • test knowledge or prepare practice questions • tailor a task to support engagement • assist with idea generation and writing • assist with administrative tasks • explain information in different ways to make it • design formative assessment activities easier to understand • analyse data that is not personal or sensitive • ask for specific feedback on work • re-word information so students at different • answer simple questions on a topic. stages of learning can understand. Department of EDUCATION AND TRAINING 27 October 2025 | TRM: 50-DBOX24-2994 Page 1 of 3 Generative artificial intelligence in schools – information for students and parents Key considerations for students The following are some things to consider when using generative AI tools: • Age restrictions: check the age restrictions of AI tools before deciding to use the AI tool. • Privacy: do not share personal, sensitive or identifiable information on these tools, as the data might be stored or used in unintended ways. • Security: use only reputable platforms and keep software up to date. • Plagiarism and copyright: follow school processes and advice on using generative AI content including applying copyright rules and acknowledging the use of content generated by AI. • Reliability: AI-generated content can be inaccurate or biased. Always review all generated content for accuracy and appropriateness. • Misuse: consequences may apply for misuse, such as creating harmful or inappropriate content. It is important to use generative AI tools responsibly and ethically. Plagiarism and assessment integrity When students use generative AI for schoolwork, it must be appropriately acknowledged. This may include naming the generative AI tools used and listing prompts given to the tools. Students should discuss this with their teacher to find out the appropriate way to do so. When students use content created by generative AI and submit it as their own, it is considered plagiarism, just like copying from a book or website without giving credit. At school, children learn what plagiarism is, why it is important to avoid it and how it can affect their grades.",Australia,1,7,C
generative-artificial-intelligence-in-schools-information-for-students-and-parents.pdf,generative-artificial-intelligence-in-schools-information-for-students-and-parents.pdf,"generative-artificial-intelligence-in-schools-information-for-students-and-parents.pdf Plagiarism and assessment integrity When students use generative AI for schoolwork, it must be appropriately acknowledged. This may include naming the generative AI tools used and listing prompts given to the tools. Students should discuss this with their teacher to find out the appropriate way to do so. When students use content created by generative AI and submit it as their own, it is considered plagiarism, just like copying from a book or website without giving credit. At school, children learn what plagiarism is, why it is important to avoid it and how it can affect their grades. When using generative AI to support assessment tasks, students should keep drafts or notes to show their work process. Teachers may check for plagiarism, so it is best for students to keep transcripts of generative AI prompts and responses to support their work if needed. Australian Framework for Generative AI in schools Education ministers across Australia have prioritised addressing the risks and opportunities of generative AI in education. The Australian Framework for Generative AI in Schools provides national guidance for the responsible and ethical use of these technologies to benefit students, schools, and society. Other helpful resources • Generative AI – policy and guideline - https://education.nt.gov.au/policies/conduct#headingNine- 1397861 • For students completing the NT Certificate of Education – Guidelines for using Artificial Intelligence (AI) in SACE assessments - https://www.sace.sa.edu.au/teaching/assessment/assessment-and-academic-integrity/guidelines- for-using-ai • Common sense media – Parents’ Ultimate Guide to Generative AI - https://www.commonsensemedia.org/articles/parents-ultimate-guide-to-generative-ai • eSafety Commissioner - https://www.esafety.gov.au/ Department of EDUCATION AND TRAINING 27 October 2025 | TRM: 50-DBOX24-2994 Page 2 of 3 Generative artificial intelligence in schools – information for students and parents Department of EDUCATION AND TRAINING 27 October 2025 | TRM: 50-DBOX24-2994 Page 3 of 3",Australia,2,7,C
