Source_File,Title,Content,Country,Chunk_ID,Topic_ID,Topic_Label_Description
Artificial_intelligence_literacy_education_in_prim.pdf,Artificial_intelligence_literacy_education_in_prim.pdf,"Artificial_intelligence_literacy_education_in_prim.pdf 1320–1320). Eshet, Y. (2004). Digital literacy: A conceptual framework for survival skills in the digital era. Journal of Educational Multimedia and Hypermedia, 13(1), 93–106. Floridi, L., Cowls, J., Beltrametti, M., Chatila, R., Chazerand, P., Dignum, V., & Vayena, E. (2018). AI4People—An ethical framework for a good AI society: Opportunities, risks, principles, and rec- ommendations. Minds and machines, 28(4), 689–707. Gong, X., Tang, Y., Liu, X., Jing, S., Cui, W., Liang, J., & Wang, F. Y. (2020). K-9 Artificial intelligence education in Qingdao: Issues, challenges and suggestions. In 2020 IEEE International Conference on Networking, Sensing and Control (ICNSC) (pp. 1–6). IEEE. Gresse von Wangenheim, C., Hauck, J. C., Pacheco, F. S., & Bertonceli Bueno, M. F. (2021). Visual tools for teaching machine learning in K-12: A ten-year systematic mapping. Education and Infor- mation Technologies, 26(5), 5733–5778. Henry, J., Hernalesteen, A., & Collard, A. S. (2021). Teaching Artificial Intelligence to K-12 Through a Role-Playing Game Questioning the Intelligence Concept. KI-Künstliche Intelligenz, 35(2), 171–179. I. H. Y. Yim, J. Su Ho, J. W., Scadding, M., Kong, S. C., Andone, D., Biswas, G., Hoppe, H. U., & Hsu, T. C. (2019). Classroom activities for teaching artificial intelligence to primary school students. In Proceedings of international conference on computational thinking education (pp. 157–159). The Education University of Hong Kong. Jobin, A., Ienca, M., & Vayena, E. (2019). The global landscape of AI ethics guidelines. Nature Machine Intelligence, 1(9), 389–399. Kandlhofer, M., Steinbauer, G., Hirschmugl-Gaisch, S., & Huber, P. (2016). Artificial intelligence and computer science in education: From kindergarten to university. In 2016 IEEE Frontiers in Educa- tion Conference (FIE) (pp. 1–9). IEEE. Kim, S., Jang, Y., Kim, W., Choi, S., Jung, H., Kim, S., & Kim, H. (2021). Why and what to teach: AI curriculum for elementary school. In proceedings of the AAAI Conference on Artificial Intelligence (Vol. 35, No. 17, pp. 15569–15576). Kreinsen, M., & Schulz, S. (2021). Students’ conceptions of artificial intelligence. In The 16th workshop in primary and secondary computing education (pp. 1–2). Lao, N. (2020). Reorienting machine learning education towards tinkerers and ML-engaged citizens (Doctoral dissertation, Massachusetts Institute of Technology). Laugksch, R. C. (2000). Scientific literacy: A conceptual overview. Science Education, 84(1), 71–94. Laupichler, M. C., Aster, A., Schirch, J., & Raupach, T. (2022). Artificial intelligence literacy in higher and adult education: A scoping literature review. Computers and Education: Artificial Intelligence, 3, 100101. Lee, S., Mott, B., Ottenbreit-Leftwich, A., Scribner, A., Taylor, S., Park, K., & Lester, J. (2021). AI- infused collaborative inquiry in upper elementary school: A game-based learning approach. In Pro- ceedings of the AAAI conference on artificial intelligence (Vol. 35, No. 17, pp. 15591–15599). Lee, S. J., & Kwon, K. (2024). A systematic review of AI education in K-12 classrooms from 2018 to 2023: Topics, strategies, and learning outcomes. Computers and Education: Artificial Intelligence, 6, 100211. Li, K., & Keller, J. M. (2018). Use of the ARCS model in education: A literature review. Computers & Education, 122, 54–62. Li, K., & Song, S. (2020). Application of artificial intelligence in primary and secondary schools: A case study of scratch. In International Conference on Applications and Techniques in Cyber Intelligence ATCI 2019: Applications and Techniques in Cyber Intelligence 7 (pp. 2026–2030). Springer Inter- national Publishing. Lin, P. Y., Chai, C. S., Jong, M. S. Y., Dai, Y., Guo, Y., & Qin, J. (2021). Modeling the structural rela- tionship among primary students’ motivation to learn artificial intelligence. Computers and Educa- tion: Artificial Intelligence, 2, 100006. Long, D., & Magerko, B. (2020). What is AI literacy? Competencies and design considerations.",Australia,25,3,T
Artificial_intelligence_literacy_education_in_prim.pdf,Artificial_intelligence_literacy_education_in_prim.pdf,"Artificial_intelligence_literacy_education_in_prim.pdf Li, K., & Song, S. (2020). Application of artificial intelligence in primary and secondary schools: A case study of scratch. In International Conference on Applications and Techniques in Cyber Intelligence ATCI 2019: Applications and Techniques in Cyber Intelligence 7 (pp. 2026–2030). Springer Inter- national Publishing. Lin, P. Y., Chai, C. S., Jong, M. S. Y., Dai, Y., Guo, Y., & Qin, J. (2021). Modeling the structural rela- tionship among primary students’ motivation to learn artificial intelligence. Computers and Educa- tion: Artificial Intelligence, 2, 100006. Long, D., & Magerko, B. (2020). What is AI literacy? Competencies and design considerations. In Pro- ceedings of the 2020 CHI conference on human factors in computing systems (pp. 1–16). Marques, L. S., Gresse von Wangenheim, C., & Hauck, J. C. (2020). Teaching machine learning in school: A systematic mapping of the state of the art. Informatics in Education, 19(2), 283–321. McCarthy, J. (2007). From here to human-level AI. Artificial Intelligence, 171(18), 1174–1182. https:// doi.o rg/1 0.1 016/j.a rtint.2 007.1 0.0 09 Melsión, G. I., Torre, I., Vidal, E., & Leite, I. (2021). Using explainability to help children understand gender bias in AI. In Interaction Design and Children (pp. 87–99). Mertala, P., Fagerlund, J., & Calderon, O. (2022). Finnish 5th and 6th grade students’ pre-instructional conceptions of artificial intelligence (AI) and their implications for AI literacy education. Comput- ers and Education: Artificial Intelligence, 3, 100095. Miao, F., Holmes, W., Huang, R., & Zhang, H. (2021). AI and education: A guidance for policymakers. UNESCO Publishing. Miao, F., & Shiohira, K. (2022). K-12 AI curricula. A mapping of government-endorsed AI curricula. Miao, F., & Shiohira, K. (2024). AI competency framework for students. Ng, D. T. K., Leung, J. K. L., Chu, S. K. W., & Qiao, M. S. (2021). Conceptualizing AI literacy: An exploratory review. Computers and Education: Artificial Intelligence, 2, 100041. Ng, D. T. K., Leung, J. K. L., Su, M. J., Yim, I. H. Y., Qiao, M. S., & Chu, S. K. W. (2023). AI literacy education in primary schools. AI Literacy in K-16 Classrooms (pp. 75–86). Springer International Publishing. Ng, D. T. K., Luo, W., Chan, H. M. Y., & Chu, S. K. W. (2022). Using digital story writing as a peda- gogy to develop AI literacy among primary students. Computers and Education: Artificial Intel- ligence, 3, 100054. Artificial intelligence literacy education in primary schools:… Ottenbreit-Leftwich, A., Glazewski, K., Jeon, M., Jantaraweragul, K., Hmelo-Silver, C. E., Scribner, A., & Lester, J. (2023). Lessons learned for AI education with elementary students and teachers. Inter- national Journal of Artificial Intelligence in Education, 33(2), 267–289. Page, M. J., McKenzie, J. E., Bossuyt, P. M., Boutron, I., Hoffmann, T. C., Mulrow, C. D., & Moher, D. (2021). The PRISMA 2020 statement: an updated guideline for reporting systematic reviews. BMJ, 372. Papert, S., & Harel, I. (1991). Situating constructionism. Constructionism, 36(2), 1–11. Relmasira, S. C., Lai, Y. C., & Donaldson, J. P. (2023). Fostering AI literacy in elementary science, technology, engineering, art, and mathematics (STEAM) education in the age of generative AI. Sustainability, 15(18), 13595. Rizvi, S., Waite, J., & Sentance, S. (2023). Artificial intelligence teaching and learning in K-12 from 2019 to 2022: A systematic literature review. Computers and Education: Artificial Intelligence, 4, 100145. Rodríguez-García, J. D., Moreno-León, J., Román-González, M., & Robles, G. (2021). Evaluation of an online intervention to teach artificial intelligence with learningml to 10–16-year-old students. In Pro- ceedings of the 52nd ACM technical symposium on computer science education (pp. 177–183). Seldon, A., & Abidoye, O. (2018). The fourth education revolution. Legend Press Ltd. Sentance, S., & Waite, J. (2022).",Australia,26,3,T
Artificial_intelligence_literacy_education_in_prim.pdf,Artificial_intelligence_literacy_education_in_prim.pdf,"Artificial_intelligence_literacy_education_in_prim.pdf Sustainability, 15(18), 13595. Rizvi, S., Waite, J., & Sentance, S. (2023). Artificial intelligence teaching and learning in K-12 from 2019 to 2022: A systematic literature review. Computers and Education: Artificial Intelligence, 4, 100145. Rodríguez-García, J. D., Moreno-León, J., Román-González, M., & Robles, G. (2021). Evaluation of an online intervention to teach artificial intelligence with learningml to 10–16-year-old students. In Pro- ceedings of the 52nd ACM technical symposium on computer science education (pp. 177–183). Seldon, A., & Abidoye, O. (2018). The fourth education revolution. Legend Press Ltd. Sentance, S., & Waite, J. (2022). Perspectives on AI and data science education. In AI, data science, and young people. Understanding computing education (Vol 3). Proceedings of the Raspberry Pi Founda- tion Research Seminars. Shamir, G., & Levin, I. (2021). Neural network construction practices in elementary school. KI-Künstliche Intelligenz, 35(2), 181–189. Shamir, G., & Levin, I. (2022). Teaching machine learning in elementary school. International Journal of Child-Computer Interaction, 31, 100415. Su, J., Zhong, Y., & Ng, D. T. K. (2022). A meta-review of literature on educational approaches for teaching AI at the K-12 levels in the Asia-Pacific region. Computers and Education: Artificial Intelligence, 3, 100065. Su, J., Guo, K., Chen, X., & Chu, S. K. W. (2024a). Teaching artificial intelligence in K–12 classrooms: A scoping review. Interactive Learning Environments, 32(9), 5207–5226 Su, J., Yim, I. H. Y., Wegerif, R., & Wah Chu, S. K. (2024c). STEAM in early childhood education: a scop- ing review. Research in Science & Technological Education. https:// doi. org/ 10. 1080/ 02635 143. 2023. 22964 45 Su, J., Yang, W., Yim, I. H. Y., Li, H., & Hu, X. (2024b). Early artificial intelligence education: Effects of cooperative play and direct instruction on kindergarteners’ computational thinking, sequencing, self- regulation and theory of mind skills. Journal of Computer Assisted Learning., 40, 2917–2925. Su, J., Ng, D. T. K., & Chu, S. K. W. (2023). Artificial intelligence (AI) literacy in early childhood educa- tion: The challenges and opportunities. Computers and Education: Artificial Intelligence, 4, 100124. Su, J., & Yang, W. (2022). Artificial intelligence in early childhood education: A scoping review. Computers and Education: Artificial Intelligence, 3, 100049. Toivonen, T., Jormanainen, I., Kahila, J., Tedre, M., Valtonen, T., & Vartiainen, H. (2020). Co-designing machine learning apps in K–12 with primary school children. In 2020 IEEE 20th International Confer- ence on Advanced Learning Technologies (ICALT) (pp. 308–310). IEEE. Tygel, A. F., & Kirsch, R. (2016). Contributions of Paulo Freire for a critical data literacy: A popular educa- tion approach. The Journal of Community Informatics. https:// doi. org/ 10. 15353/ joci. v12i3. 3279 Van Brummelen, J., Tabunshchyk, V., & Heng, T. (2021). “Alexa, Can I program you?”: Student perceptions of conversational artificial intelligence before and after programming Alexa. In Interaction Design and Children (pp. 305–313). Vartiainen, H., Tedre, M., & Valtonen, T. (2020). Learning machine learning with very young children: Who is teaching whom? International Journal of Child-Computer Interaction, 25, 100182. Voulgari, I., Zammit, M., Stouraitis, E., Liapis, A., & Yannakakis, G. (2021). Learn to machine learn: designing a game based approach for teaching machine learning to primary and secondary education students. In Interaction design and children (pp. 593–598). Vuorikari Rina, R., Kluzer, S., & Punie, Y. (2022). DigComp 2.2: The Digital Competence Framework for Citizens-With new examples of knowledge, skills and attitudes (No. JRC128415). Joint Research Cen- tre (Seville site). Watson, S., & Romic, J. (2023). ChatGPT and the entangled evolution of society, education, and technol- ogy: A systems theory perspective. European Educational Research Journal, 24(2), 205–224. Williams, R., Park, H. W., Oh, L., & Breazeal, C. (2019).",Australia,27,3,T
Artificial_intelligence_literacy_education_in_prim.pdf,Artificial_intelligence_literacy_education_in_prim.pdf,"Artificial_intelligence_literacy_education_in_prim.pdf Learn to machine learn: designing a game based approach for teaching machine learning to primary and secondary education students. In Interaction design and children (pp. 593–598). Vuorikari Rina, R., Kluzer, S., & Punie, Y. (2022). DigComp 2.2: The Digital Competence Framework for Citizens-With new examples of knowledge, skills and attitudes (No. JRC128415). Joint Research Cen- tre (Seville site). Watson, S., & Romic, J. (2023). ChatGPT and the entangled evolution of society, education, and technol- ogy: A systems theory perspective. European Educational Research Journal, 24(2), 205–224. Williams, R., Park, H. W., Oh, L., & Breazeal, C. (2019). Popbots: Designing an artificial intelligence cur- riculum for early childhood education. In Proceedings of the AAAI Conference on Artificial Intelli- gence (Vol. 33, No. 01, pp. 9729–9736). I. H. Y. Yim, J. Su Wing, J. M. (2006). Computational thinking. Communications of the ACM, 49(3), 33–35. Xu, Y., Liu, X., Cao, X., Huang, C., Liu, E., Qian, S., & Zhang, J. (2021). Artificial intelligence: A powerful paradigm for scientific research. The Innovation, 2(4), 100179. Yim, I. H. Y. (2023). Design of Artificial Intelligence (AI) Education for Primary Schools: Arts-based Approach (pp. 65–90). Istes Books. Yim, I. H. Y. (2024a). A critical review of teaching and learning artificial intelligence (AI) literacy: Devel- oping an intelligence-based AI literacy framework for primary school education. Computers and Edu- cation: Artificial Intelligence, 100319. Yim, I. H. Y. (2024b). Artificial intelligence literacy in primary education: An arts-based approach to over- coming age and gender barriers. Computers and Education: Artificial Intelligence, 7, 100321. Yim, I. H. Y., & Wegerif, R. (2024). Teachers’ perceptions, attitudes, and acceptance of artificial intelli- gence (AI) educational learning tools: An exploratory study on AI literacy for young students. Future in Educational Research, 2(4), 318–345. Yim, I. H. Y., & Su, J. (2024). Artificial intelligence (AI) learning tools in K-12 education: A scoping review. Journal of Computers in Education, 12, 1–39. Yim, I. H. Y., Su, J., & Wegerif, R. (2024). STEAM in practice and research in primary schools: a system- atic literature review. Research in Science & Technological Education, 1–25. Yue, M., Jong, M. S. Y., & Dai, Y. (2022). Pedagogical design of K-12 artificial intelligence education: A systematic review. Sustainability, 14(23), 15620. Publisher’s Note Springer Nature remains neutral with regard to jurisdictional claims in published maps and institutional affiliations.",Australia,28,3,T
Generative_AI_Usage_Policy.pdf,Generative_AI_Usage_Policy.pdf,"Generative_AI_Usage_Policy.pdf THE HUTCHINS SCHOOL Generative AI usage policy Relevant legislation Anti-Discrimination Act 1998 (Tas) Australian Curriculum, Assessment and Reporting Authority (ACARA) Australian Cyber Security Centre (ACSC) Guidelines Australian Privacy Principles (APPs) Child Safe Standards Framework (Tas) Disability Discrimination Act 1992 (Cth) Education Act 2016 (Tas) Notifiable Data Breaches (NDB) Scheme Privacy Amendment (Notifiable Data Breaches) Act 2017 (Cth) Tasmanian Assessment, Standards and Certification (TASC) Privacy Act 1988 (Cth) Commencement date 01 March 2025 Last review date 01 March 2025 1. Purpose The purpose of this policy is to outline The Hutchins School’s standards for safe, responsible and ethical use of Generative Artificial Intelligence (Generative AI) tools. It has been produced to align with the Australian Framework for Generative AI in Schools and to reflect the requirements of The Privacy Act 1988 (Cth). 2. Scope This policy applies to Hutchins staff and students using Generative AI tools for communication, teaching and learning activities, administration or other school-related activities. It does not cover the use of Predictive Artificial Intelligence. 3. Definitions Generative AI can generate new content such as text, images, audio and video that Generative Artifical Intelligence resembles what humans can produce. It is effective at recognising patterns (in video, audio, text or images) and emulating them when tasked with producing something. Source: Australian Framework for Generative Artificial Intelligence in Schools This policy distinguishes between two definitions in order to provide clarity to what may and Intellectual Property (IP) may not be shared with Generative AI. These definitions are: Intellectual Property, which includes but is not limited to: Created by: Head of Teaching and Learning, Policy & Compliance Manager Document version: 1.0 Online location: https://myhutchinstasedu.sharepoint.com/sites/PolicyCompliance Next review date: March 2028 Printed copies are uncontrolled. For the latest version please refer to SharePoint Online. CRICOS 00478F Page 1 of 2 • curricula; • teaching materials; • policies; and • branding. Generally speaking, Intellectual Property that is already publicly accessible or available online in very similar forms (e.g. a blank Individual Learning Plan template) may form part of a Generative AI prompt without concern (if it is blank and does not contain personal or sensitive information, as defined here). Protected Intellectual Property (IP), which includes (but is not limited to): • school-owned or generated research; • training modules or presentations created for internal use; • proprietary systems developed by the School; • resources purchased for or generated by the School for internal use; • strategic planning documentation; and • any documentation explicitly marked as ‘confidential’. Protected IP remains the exclusive property of the School, and must not be shared, reproduced or distributed, including with Generative AI. “Information or an opinion about an identified individual, or an individual who is reasonably Personal Information identifiable, whether the information or opinion is true or not, and whether the information or opinion is recorded in a material form or not.” Source: The Privacy Act 1988 (Cth) Predictive artificial intelligence (AI) involves using statistical analysis and machine learning Predictive Artificial Intelligence (ML) to identify patterns, anticipate behaviors and forecast upcoming events. Source: IBM corporation “Information… about an individual” such as: Sensitive Information • racial or ethnic origin; • political opinions; • membership of a political association; • religious beliefs or affiliations; • philosophical beliefs; • membership of a trade union or professional association; • sexual orientation or practices; • criminal record; • health information; • genetic information; and • biometric information used for automated biometric verification or identification.",Australia,1,2,W
Generative_AI_Usage_Policy.pdf,Generative_AI_Usage_Policy.pdf,"Generative_AI_Usage_Policy.pdf Source: IBM corporation “Information… about an individual” such as: Sensitive Information • racial or ethnic origin; • political opinions; • membership of a political association; • religious beliefs or affiliations; • philosophical beliefs; • membership of a trade union or professional association; • sexual orientation or practices; • criminal record; • health information; • genetic information; and • biometric information used for automated biometric verification or identification. Document name and version: Generative AI Usage Policy 1.0 CRICOS 00478F Page 2 of 3 Source: The Privacy Act 1988 (Cth) Information supplied by a person to a Generative AI with the purpose of generating a Prompt response. A prompt may be a question, piece of text, code, image or example. 4. Key accountabilites This policy is designed to support staff and students in the use of Generative AI (also: GenAI) tools in ways that enhance learning and wellbeing. Generative AI tools can be valuable in supporting educational outcomes for learners and reducing workloads for staff, but it is important that their use is fair, ethical and within the boundaries and guidelines established by the School, by legislation and by best practice organisations. Generative AI tools may be used by staff and students at the School: • to support and enhance teaching and learning; • for the benefit of all members of the school community; and • in ways that are inclusive, accessible, fair and respectful. Managers and supervisors are responsible for: • supporting Generative AI practices that protect the privacy, security and safety of all members of the school community; • adhering to copyright obligations and complying with relevant legislation; • engaging staff in learning about Generative AI tools and their benefits, risks, limitations and biases; • supporting staff and students in the use of Generative AI in ways that are ethical and safe, preserving human agency, accountability, and decision-making; • supporting staff compliance with Standard 7 of the Standards for the Provision of TASC-accredited Senior Secondary Courses; • providing guidance in the use of School-approved Generative AI tools and informing staff and students with respect to tools that may compromise security; and • ensuring that students and families have access to clear and appropriate information and guidance on the use of Generative AI in line with Academic Integrity Protocols (see supporting/related documents). Staff are responsible for: • ensuring safe, ethical and compliant use of Generative AI within the scope of their work and role; • using Generative AI tools in line with existing curriculum, procedures, standards and guidelines (see supporting/related documents); • ensuring that prompts used to produce Generative AI outputs do not include: − ‘Personal Information’ regarding staff, students or members of the School community; Document name and version: Generative AI Usage Policy 1.0 CRICOS 00478F Page 3 of 4 − ‘Sensitive Information’ that can be linked to specific individuals (either through the inclusion of personal information or through context); − Confidential or identifiable school data (e.g. If staff are unsure whether performance reviews, financial data, assessment or exam certain types of data may be details, strategic or operational documents) that can be shared with Generative AI they linked back to individuals or the School (either through the must contact the IT team for inclusion of personal information or through context); or support and advice.",Australia,2,7,C
